{
  "schema_identity": "infinium.repository.m1-slice6-successor-credential-replacement-review/1.0.0",
  "review_id": "infinium.m1-s6.successor-credential-replacement-generation-3-review/340bf1b5-abab-4dec-850c-09838ab1ffce",
  "verdict": "accept",
  "reviewer_id": "/root/successor-design-review",
  "independent": true,
  "provider_effect_used": false,
  "subject": {
    "id": "infinium.m1-s6.successor-credential-replacement-generation-3/a942ce52-81b3-4363-ac16-2e16745f326f",
    "sha256": "d4a93a3e09c2a5e6c489a795ecec971d2b4aae4dd5796be65b55326f0d59504a"
  },
  "findings": [],
  "reviewed_at_utc": "2026-08-22T02:31:19.8627857Z"
}
